title,difficulty,category
Al Pacino,1,Actor,"Serpico, Scent of a Woman, Dog Day Afternoon, The Godfather: Part II"
Alan Arkin,1,Actor,"Argo, Little Miss Sunshine, The Heart Is a Lonely Hunter"
Alan Rickman,1,Actor,"Michael Collins, Truly Madly Deeply, Sense and Sensibility"
Albert Finney,1,Actor,"The Murder on the orient Express, The Dresser, Under the Volcano"
Alec Guinness,1,Actor,"Star Wars, Little Dorrit, The Bridge on the River Kwai"
Anthony Hopkins,1,Actor,"The Silence of the Lambs, Nixon, The Remains of the Day"
Anthony Quinn,1,Actor,"Lust for Life, Viva Zapata!, Alexis Zorbas"
Ben Kingsley,1,Actor,"Gandhi, Sexy Beast, House of Sand and Fog"
Benicio Del Toro,1,Actor,"Traffic, Grams, The Pledge"
Bill Murray,1,Actor,"Rushmore, Lost in Translation, Hyde Park on Hudson"
Brad Pitt,1,Actor,"The Curious Case of Benjamin Button, Moneyball, Twelve Monkeys"
Burt Lancaster,1,Actor,"Atlantic City, Elmer Gantry, From Here to Eternity"
Cary Grant,1,Actor,"Charade, Penny Serenade, Not But the Lonely Heart"
Charles Chaplin,1,Actor,"The Great Dictator, City Lights, Modern Times"
Charles Laughton,1,Actor,"Mutiny on the Bounty, Witness for the Prosecution, The Private Life of Henry VIII"
Charlton Heston,1,Actor,"Ben-Hur, The Ten Commandments, The Pigeon That Took Rome"
Christian Bale,1,Actor,"The Fighter, The Dark Knight, American Hustle"
Christoph Waltz,1,Actor,"Carnage, Django Unchained, Inglourious Bastards"
Christopher Plummer,1,Actor,"Beginners, The Last Station, The Sound of Music"
Christopher Walken,1,Actor,"Hairspray, The Deer Hunter, King of New York, Catch Me If You Can"
Clark Gable,1,Actor,"Gone with the Wind, Mutiny on the Bounty, It Happened One Night"
Clint Eastwood,1,Actor,"Million Dollar Baby, Unforgiven, Million Dollar Baby, The Good, the Bad, and the Ugly"
Colin Firth,1,Actor,"A Single Man, The King's Speech, Tinker Tailor Soldier Spy"
Daniel Day-Lewis,1,Actor,"There Will Be Blood, Lincoln, My Left Foot"
Denzel Washington,1,Actor,"Fences, Glory, Malcolm X, Training Day"
Don Cheadle,1,Actor,"The Rat Pack, House of Lies, Hotel Rwanda"
Dustin Hoffman,1,Actor,"Tootsie, Rain Man, Midnight Cowboy, Kramer vs. Kramer"
Edward Norton,1,Actor,"Primal Fear, American History X, Everyone Says I Love You"
Gary Cooper,1,Actor,"High Noon, Sergeant York, Mr. Deeds Goes to Town"
Gary Oldman,1,Actor,"Prick Up Your Ears, Leon: The Professional, Tinker Tailor Soldier Spy"
Gene Hackman,1,Actor,"Unforgiven, Mississippi Burning, The French Connection"
Gene Kelly,1,Actor,"Hello, Dolly!, Anchors Aweigh, An American in Paris"
Geoffrey Rush,1,Actor,"Shine, Quills, The King's Speech"
George C. Scott,1,Actor,"Patton, The Hustler, The Hospital"
Gregory Peck,1,Actor,"To Kill a Mockingbird, The Boys from Brazil, Gentleman's Agreement"
Harrison Ford,1,Actor,"Witness, Star Wars, The Fugitive"
Heath Ledger,1,Actor,"Candy, The Dark Knight, Brokeback Mountain"
Henry Fonda,1,Actor,"Angry Men, On Golden Pond, The Grapes of Wrath"
Hugh Jackman,1,Actor,"Logan, The Fountain, Les Miserables, Kate & Leopold"
Humphrey Bogart,1,Actor,"Casablanca, The Caine Mutiny, The African Queen"
Ian McKellen,1,Actor,"The Lord of the Rings: The Fellowship of the Ring, Richard III, Gods and Monsters"
Jack Lemmon,1,Actor,"The Apartment, Mister Roberts, Save the Tiger, Some Like It Hot"
Jack Nicholson,1,Actor,"The Shining, Chinatown, As Good as It Gets, One Flew Over The Cuckoo's Nest"
James Cagney,1,Actor,"Love Me or Leave Me, Yankee Doodle Dandy, Angles with Dirty Faces"
James Dean,1,Actor,"Giant, East of Eden, Rebel Without a Cause"
James Stewart,1,Actor,"Anatomy of a Murder, It's a Wonderful Life, A Philadelphia Story, Mr. Smith Goes to Washington"
Jamie Foxx,1,Actor,"Ray, Django Unchained, Collateral"
Jason Robards,1,Actor,"Julia, Melvin and Howard, All the President's Men"
Javier Bardem,1,Actor,"Biutiful, Before Night Falls, No Country for Old Men"
Jeff Bridges,1,Actor,"The Big Lebowski, Starman, True Grit, Crazy Heart"
Jeremy Irons,1,Actor,"Dead Ringers, Reversal of Fortune, aBrideshead Revisited"
Jim Carrey,1,Actor,"Man on the Moon, The Truman Show, Eternal Sunshine of the Spotless Mind"
Joaquin Phoenix,1,Actor,"Her, The Master, Walk the Line"
Joe Pesci,1,Actor,"Casino, Goodfellas, Raging Bull"
John Goodman,1,Actor,"Flight, Barton Fink, The Big Lebowski"
John Travolta,1,Actor,"Saturday Night Fever, Pulp Fiction, Grease"
John Wayne,1,Actor,"True Grit, The Alamo, Sands of Iwo Jima"
Johnny Depp,1,Actor,"Ed Wood, Donnie Brasco, Edward Scissorhands"
Jon Voight,1,Actor,"Coming Home, Runaway Train, Midnight Cowboy"
Kevin Spacey,1,Actor,"The Usual Suspects, L.A. Confidential, Se7en, American Beauty"
Kirk Douglas,1,Actor,"Spartacus, Champion, Lust for Life, The Bad and the Beautiful"
Laurence Olivier,1,Actor,"Sleuth, Hamlet, Rebecca, Spartacus"
Leonardo DiCaprio,1,Actor,"Titanic, Inception, The Revenant, The Wolf of Wall Street, What's Eating Gilbert Grape"
Liam Neeson,1,Actor,"Kinsey, Michael Collins, Schindler's List"
Marlon Brando,1,Actor,"The Godfather, Apocalypse Now, On the Waterfront, A Street Car Named Desire"
Martin Sheen,1,Actor,"Kennedy, Apocalypse Now, The Subject Wad Roses"
Matt Damon,1,Actor,"Invictus, Good Will Hunting, The Talented Mr. Ripley"
Matthew McConaughey,1,Actor,"Killer Joe, True Detective, Dallas Buyers Club"
Mel Gibson,1,Actor,"Ransom, Braveheart, What Women Want"
Michael Caine,1,Actor,The Dark Knight, Educated Rita, The Cider House Rules, Hannah and Her Sisters"
Michael Douglas,1,Actor,"Behind the Candelabra, Wall Street, Wonder Boys, Fatal Attraction"
Morgan Freeman,1,Actor,"The Shawshank Redemption, Se7en, Glory, Million Dollar Baby"
Nicolas Cage,1,Actor,"Valley Girl, Leaving Las Vegas, Adaptation"
Orson Welles,1,Actor,"Butterfly, Citizen Kane, Chimes at Midnight"
Paul Newman,1,Actor,"The Hustler, The Verdict, Road to Perdition, The Color of Money"
Peter Finch,1,Actor,"Network, Sunday Bloody Sunday, The Flight of the Phoenix"
Peter O'Toole,1,Actor,"Lawrence of Arabia, Becket, The Lion in Winter"
Peter Sellers,1,Actor,"Being There, The Running, Jumping & Standing Still Film, Doctor Strangelove or: How I Learned to Stop Worrying and Love the Bomb"
Philip Seymour Hoffman,1,Actor,"Capote, Doubt, The Master"
Ralph Fiennes,1,Actor,"The Grand Budapest Hotel, Schindler's List, The English Patient"
Richard Burton,1,Actor,"Equus, My Cousin Rachel, Who's Afraid of Virginia Woolf?"
Robert De Niro,1,Actor,"Raging Bull, The Deer Hunter, The Godfather: Part II, Goodfellas, Taxi Driver"
Robert Downey Jr.,1,Actor,"Chaplin, Tropic Thunder, Sherlock Homes"
Robert Duvall,1,Actor,"The Apostle, Tender Mercies, Lonesome Dove"
Robert Mitchum,1,Actor,"Story of G.I. Joe, The Longest Day, Heaven Knows, Mr. Allison"
Robert Redford,1,Actor,"The String, Downhill Racer, Tell Them Willie Boy Is Here"
Robin Williams,1,Actor,"Mrs. Doubtfire, The Fisher King, Good Will Hunting, Dead Poets Society"
Russell Crowe,1,Actor,"Gladiator, The Insider, A Beautiful Mind, Les Misérables"
Samuel L. Jackson,1,Actor,"Pulp Fiction, Jackie Brown, A Time to Kill"
Sean Connery,1,Actor,"The Untouchables, The Russia House, The Family Business"
Sean Penn,1,Actor,"Milk, I Am Sam, Mystic River"
Sidney Poitier,1,Actor,"Guess Who's Coming to Dinner, Lilies of the Field, The Defiant Ones, In the Heat of the Night"
Spencer Tracy,1,Actor,"Guess Who's Coming to Dinner, Boys Town, Captains Courageous, Judgement at Nuremberg"
Steve McQueen,1,Actor,"Papillon, The Sand Pebbles, Love with the Proper Stranger"
Tom Cruise,1,Actor,"Top Gun, Magnolia, Jerry Maguire, Born on the Fourth of July"
Tom Hanks,1,Actor,"Cast Away, Forrest Gump, Philadelphia, Saving Private Ryan"
Tommy Lee Jones,1,Actor,"In the Valley of Elah, Lincoln, The Fugitive"
Will Smith,1,Actor,"The Pursuit of Happiness, Ali, Concussion"
William Holden,1,Actor,"Network, Stalag 1Sunset Blvd."
Woody Allen,1,Actor,"Annie Hall, Manhattan, Take the Money and Run"
